{"schema_version":"evidence_response.v1","request_id":"u7-r1","status":"ok","provenance":{"repo":"gcp-reviewer-agent","sha":"9bddbb8","tool":"test-runner","tool_version":"vitest-5.0.5","execution_id":"t-4411","captured_at":"2026-10-22T10:15:00Z","truncated":false,"redacted":true},"limits":{"max_bytes":8000,"time_ms":1240,"time_limit_ms":120000},"content":{"tests":[{"name":"reviewer retries once on timeout","passed":true}]},"uncertainty":"One test reaches reviewUnit's retry path; the success-then-retry case is not covered."}
